{
  "id": "full-bleed-band",
  "family": "photo",
  "title": "Full-bleed + type band",
  "canvas": {
    "choices": [
      [
        1600,
        900
      ],
      [
        1920,
        1080
      ]
    ]
  },
  "background": "#0b1220",
  "photo": {
    "offset_jitter": [
      40,
      20
    ]
  },
  "copy": {
    "kicker": [
      "VOL. 08",
      "ISSUE 12",
      "FIELD NOTES",
      "DISPATCH",
      "SPECIAL"
    ],
    "head": [
      "THE MACHINE WAS NEVER THE KEYBOARD",
      "WE SENT A CRAFT PAST THE LAST PLANET",
      "THE BLUE MARBLE WAS NEVER SMALL",
      "SLOW, EXACT, AND ALREADY GONE"
    ]
  },
  "rects": [
    {
      "x1": 0,
      "y1": "int(H*0.70)",
      "x2": "W",
      "y2": "H",
      "fill": "#0b1220"
    }
  ],
  "texts": [
    {
      "text": "{kicker}",
      "x": 48,
      "y": "int(H*0.73)",
      "size": 16,
      "color": "#f4d27a"
    },
    {
      "text": "{head}",
      "x": 48,
      "y": "int(H*0.78)",
      "size": 32,
      "color": "#f6f1e8"
    }
  ]
}
