{
  "id": "overlay-punch",
  "family": "photo",
  "title": "Overlay contrast",
  "canvas": [
    1600,
    900
  ],
  "background": "#222",
  "photo": {
    "blend": "overlay",
    "offset_jitter": [
      20,
      20
    ]
  },
  "copy": {
    "head": [
      "THE MACHINE WAS NEVER THE KEYBOARD",
      "WE SENT A CRAFT PAST THE LAST PLANET",
      "THE BLUE MARBLE WAS NEVER SMALL",
      "SLOW, EXACT, AND ALREADY GONE"
    ]
  },
  "texts": [
    {
      "text": "{head}",
      "x": 48,
      "y": "H-80",
      "size": 28,
      "color": "#ffffff"
    }
  ]
}
