{
  "id": "hard-light-hit",
  "family": "photo",
  "title": "Hard light",
  "canvas": [
    1600,
    900
  ],
  "background": "#111",
  "photo": {
    "blend": "hard_light",
    "offset_jitter": [
      20,
      20
    ]
  },
  "copy": {
    "head": [
      "HIT"
    ]
  },
  "texts": [
    {
      "text": "{head}",
      "x": 48,
      "y": 48,
      "size": 64,
      "color": "#ffffff"
    }
  ]
}
